{
  "$schema": "http://json-schema.org/draft-07/schema#",
  "$id": "https://clawrocket.dev/contracts/editorial-room/v0/suggestion.schema.json",
  "title": "Suggestion",
  "description": "Wire shape for a Skill-returned suggestion against a draft revision. clawrocket persists these as TalkOutputSuggestion rows. See EDITORIAL_ROOM_CONTRACT.md §5.3. SourceMapRef and SuggestionCategory live in this schema's definitions per §10.",
  "type": "object",
  "additionalProperties": false,
  "definitions": {
    "SourceMapRef": {
      "type": "object",
      "additionalProperties": false,
      "required": ["block_id", "span_id", "text_hash"],
      "properties": {
        "block_id": { "type": "string", "minLength": 1 },
        "span_id": {
          "anyOf": [{ "type": "null" }, { "type": "string", "minLength": 1 }],
          "description": "Null = whole block."
        },
        "text_hash": {
          "type": "string",
          "minLength": 1,
          "description": "For verification at resolve time."
        }
      }
    },
    "MarkdownRange": {
      "type": "object",
      "additionalProperties": false,
      "required": ["start", "end"],
      "properties": {
        "start": { "type": "integer", "minimum": 0 },
        "end": { "type": "integer", "minimum": 0 }
      }
    },
    "SuggestionCategory": {
      "type": "string",
      "enum": [
        "filler",
        "repetition",
        "hedge",
        "weak_verb",
        "tangent",
        "wording",
        "structure",
        "voice_drift",
        "missing_premise",
        "weak_claim",
        "unsupported_leap",
        "would_lose_persona",
        "evidence_gap",
        "claim_unbacked",
        "claim_contradicts_ledger",
        "other"
      ]
    }
  },
  "required": [
    "schema_version",
    "revision_id",
    "target_content_hash",
    "source_map_refs",
    "markdown_range",
    "anchor_quote",
    "anchor_content_hash",
    "anchor_context_before",
    "anchor_context_after",
    "replacement",
    "rationale",
    "category",
    "source_skill",
    "source_run_id"
  ],
  "properties": {
    "schema_version": { "const": "0" },
    "revision_id": {
      "type": "string",
      "minLength": 1,
      "description": "Revision the Skill READ."
    },
    "target_content_hash": {
      "type": "string",
      "minLength": 1,
      "description": "Hash of that revision's content_md_snapshot."
    },
    "source_map_refs": {
      "type": "array",
      "items": { "$ref": "#/definitions/SourceMapRef" }
    },
    "markdown_range": { "$ref": "#/definitions/MarkdownRange" },
    "anchor_quote": {
      "type": "string",
      "description": "Exact text the range matched (fallback)."
    },
    "anchor_content_hash": {
      "type": "string",
      "minLength": 1,
      "description": "Hash of source Markdown snapshot (fallback)."
    },
    "anchor_context_before": {
      "anyOf": [{ "type": "null" }, { "type": "string" }]
    },
    "anchor_context_after": {
      "anyOf": [{ "type": "null" }, { "type": "string" }]
    },
    "replacement": {
      "anyOf": [{ "type": "null" }, { "type": "string" }],
      "description": "Null = pure cut."
    },
    "rationale": { "type": "string", "minLength": 1 },
    "category": { "$ref": "#/definitions/SuggestionCategory" },
    "source_skill": { "type": "string", "minLength": 1 },
    "source_run_id": { "type": "string", "minLength": 1 }
  }
}
