[
  {
    "schema_version": "0",
    "revision_id": "01HXYZREV001AAAAAAAAAAAAAA",
    "target_content_hash": "sha256:rev001aaa00000000000000000000000000000000000000000000000000000000",
    "source_map_refs": [
      {
        "block_id": "blk_0001",
        "span_id": null,
        "text_hash": "sha256:b0001hash00000000000000000000000000000000000000000000000000000000"
      }
    ],
    "markdown_range": { "start": 0, "end": 268 },
    "anchor_quote": "When Embracer wrote down $2.1B last quarter",
    "anchor_content_hash": "sha256:rev001aaa00000000000000000000000000000000000000000000000000000000",
    "anchor_context_before": "",
    "anchor_context_after": ", the surviving",
    "replacement": "Embracer's $2.1B writedown last quarter rewrote one line in their 8-K — and that single change reset every active publisher deal in the indie pipeline.",
    "rationale": "Lede: open on the structural mechanism (the 8-K rewrite), not the writedown headline. The reclassification is the load-bearing claim; lead with it.",
    "category": "structure",
    "source_skill": "factory_opus_review",
    "source_run_id": "01HXYZRUNOPUSREV001AAAAAAAA"
  },
  {
    "schema_version": "0",
    "revision_id": "01HXYZREV001AAAAAAAAAAAAAA",
    "target_content_hash": "sha256:rev001aaa00000000000000000000000000000000000000000000000000000000",
    "source_map_refs": [
      {
        "block_id": "blk_0002",
        "span_id": null,
        "text_hash": "sha256:b0002hash00000000000000000000000000000000000000000000000000000000"
      }
    ],
    "markdown_range": { "start": 268, "end": 498 },
    "anchor_quote": "they weren't visible when Embracer announced",
    "anchor_content_hash": "sha256:rev001aaa00000000000000000000000000000000000000000000000000000000",
    "anchor_context_before": "in ways that ",
    "anchor_context_after": ".",
    "replacement": "the announcement buried them on page 14 of the 8-K",
    "rationale": "Wording: 'weren't visible' is passive and vague; cite the page reference (matches voice signature 'numbers > adjectives' + 'cite primary sources').",
    "category": "wording",
    "source_skill": "factory_opus_review",
    "source_run_id": "01HXYZRUNOPUSREV001AAAAAAAA"
  },
  {
    "schema_version": "0",
    "revision_id": "01HXYZREV001AAAAAAAAAAAAAA",
    "target_content_hash": "sha256:rev001aaa00000000000000000000000000000000000000000000000000000000",
    "source_map_refs": [
      {
        "block_id": "blk_0003",
        "span_id": null,
        "text_hash": "sha256:b0003hash00000000000000000000000000000000000000000000000000000000"
      }
    ],
    "markdown_range": { "start": 500, "end": 734 },
    "anchor_quote": "Second, recoupment terms have hardened.",
    "anchor_content_hash": "sha256:rev001aaa00000000000000000000000000000000000000000000000000000000",
    "anchor_context_before": "accounting. ",
    "anchor_context_after": "",
    "replacement": "Second, recoupment hardened from 1.0× to 1.4× across the post-announcement signings I've seen.",
    "rationale": "Voice drift: 'have hardened' is too clean for GameMakers cadence. Concretize with the observed delta and ground it in first-person observation.",
    "category": "voice_drift",
    "source_skill": "factory_opus_review",
    "source_run_id": "01HXYZRUNOPUSREV001AAAAAAAA"
  },
  {
    "schema_version": "0",
    "revision_id": "01HXYZREV001AAAAAAAAAAAAAA",
    "target_content_hash": "sha256:rev001aaa00000000000000000000000000000000000000000000000000000000",
    "source_map_refs": [
      {
        "block_id": "blk_0004",
        "span_id": null,
        "text_hash": "sha256:b0004hash00000000000000000000000000000000000000000000000000000000"
      }
    ],
    "markdown_range": { "start": 736, "end": 872 },
    "anchor_quote": "when the publisher claims structural risk",
    "anchor_content_hash": "sha256:rev001aaa00000000000000000000000000000000000000000000000000000000",
    "anchor_context_before": "lower thresholds ",
    "anchor_context_after": ".",
    "replacement": "when the publisher claims structural risk — and post-Embracer, the 'structural risk' claim is now reflexive",
    "rationale": "Wording: closing the third component without naming the reflex undersells the change. Add the second clause to land the implication.",
    "category": "wording",
    "source_skill": "factory_opus_review",
    "source_run_id": "01HXYZRUNOPUSREV001AAAAAAAA"
  }
]
