[
  {
    "schema_version": "0",
    "revision_id": "01HXYZREV001AAAAAAAAAAAAAA",
    "target_content_hash": "sha256:rev001aaa00000000000000000000000000000000000000000000000000000000",
    "source_map_refs": [
      {
        "block_id": "blk_0001",
        "span_id": null,
        "text_hash": "sha256:b0001hash00000000000000000000000000000000000000000000000000000000"
      }
    ],
    "markdown_range": { "start": 0, "end": 4 },
    "anchor_quote": "When",
    "anchor_content_hash": "sha256:rev001aaa00000000000000000000000000000000000000000000000000000000",
    "anchor_context_before": "",
    "anchor_context_after": " Embracer wrote down",
    "replacement": null,
    "rationale": "Trim 'When' filler — the temporal anchor 'last quarter' carries the timing.",
    "category": "filler",
    "source_skill": "factory_adv_cut",
    "source_run_id": "01HXYZRUNADVCUT001AAAAAAAAA"
  },
  {
    "schema_version": "0",
    "revision_id": "01HXYZREV001AAAAAAAAAAAAAA",
    "target_content_hash": "sha256:rev001aaa00000000000000000000000000000000000000000000000000000000",
    "source_map_refs": [
      {
        "block_id": "blk_0002",
        "span_id": null,
        "text_hash": "sha256:b0002hash00000000000000000000000000000000000000000000000000000000"
      }
    ],
    "markdown_range": { "start": 332, "end": 369 },
    "anchor_quote": "this isn't news. They lived through",
    "anchor_content_hash": "sha256:rev001aaa00000000000000000000000000000000000000000000000000000000",
    "anchor_context_before": "2024-2025, ",
    "anchor_context_after": " the conversion.",
    "replacement": "they lived it",
    "rationale": "Tighten repetition: 'this isn't news. They lived through' compresses to 'they lived it'.",
    "category": "repetition",
    "source_skill": "factory_adv_cut",
    "source_run_id": "01HXYZRUNADVCUT001AAAAAAAAA"
  },
  {
    "schema_version": "0",
    "revision_id": "01HXYZREV001AAAAAAAAAAAAAA",
    "target_content_hash": "sha256:rev001aaa00000000000000000000000000000000000000000000000000000000",
    "source_map_refs": [
      {
        "block_id": "blk_0003",
        "span_id": null,
        "text_hash": "sha256:b0003hash00000000000000000000000000000000000000000000000000000000"
      }
    ],
    "markdown_range": { "start": 580, "end": 624 },
    "anchor_quote": "may have been reclassified",
    "anchor_content_hash": "sha256:rev001aaa00000000000000000000000000000000000000000000000000000000",
    "anchor_context_before": "MG itself ",
    "anchor_context_after": " as a conditional liability",
    "replacement": "is reclassified",
    "rationale": "Hedge: 'may have been' weakens a claim sourced to filings; the 8-K is unambiguous.",
    "category": "hedge",
    "source_skill": "factory_adv_cut",
    "source_run_id": "01HXYZRUNADVCUT001AAAAAAAAA"
  },
  {
    "schema_version": "0",
    "revision_id": "01HXYZREV001AAAAAAAAAAAAAA",
    "target_content_hash": "sha256:rev001aaa00000000000000000000000000000000000000000000000000000000",
    "source_map_refs": [
      {
        "block_id": "blk_0003",
        "span_id": null,
        "text_hash": "sha256:b0003hash00000000000000000000000000000000000000000000000000000000"
      }
    ],
    "markdown_range": { "start": 668, "end": 696 },
    "anchor_quote": "have hardened",
    "anchor_content_hash": "sha256:rev001aaa00000000000000000000000000000000000000000000000000000000",
    "anchor_context_before": "recoupment terms ",
    "anchor_context_after": ".",
    "replacement": "tightened to 1.4×",
    "rationale": "Weak verb 'hardened' is vague; replace with the concrete change observed in deals.",
    "category": "weak_verb",
    "source_skill": "factory_adv_cut",
    "source_run_id": "01HXYZRUNADVCUT001AAAAAAAAA"
  },
  {
    "schema_version": "0",
    "revision_id": "01HXYZREV001AAAAAAAAAAAAAA",
    "target_content_hash": "sha256:rev001aaa00000000000000000000000000000000000000000000000000000000",
    "source_map_refs": [
      {
        "block_id": "blk_0004",
        "span_id": null,
        "text_hash": "sha256:b0004hash00000000000000000000000000000000000000000000000000000000"
      }
    ],
    "markdown_range": { "start": 814, "end": 870 },
    "anchor_quote": "and this is the piece most studios miss",
    "anchor_content_hash": "sha256:rev001aaa00000000000000000000000000000000000000000000000000000000",
    "anchor_context_before": "Third — ",
    "anchor_context_after": " — conditional advances",
    "replacement": null,
    "rationale": "Tangent: meta-commentary about what readers miss; cut without losing the substance.",
    "category": "tangent",
    "source_skill": "factory_adv_cut",
    "source_run_id": "01HXYZRUNADVCUT001AAAAAAAAA"
  },
  {
    "schema_version": "0",
    "revision_id": "01HXYZREV001AAAAAAAAAAAAAA",
    "target_content_hash": "sha256:rev001aaa00000000000000000000000000000000000000000000000000000000",
    "source_map_refs": [
      {
        "block_id": "blk_0005",
        "span_id": null,
        "text_hash": "sha256:b0005hash00000000000000000000000000000000000000000000000000000000"
      }
    ],
    "markdown_range": { "start": 882, "end": 942 },
    "anchor_quote": "If you're signing in the next 18 months",
    "anchor_content_hash": "sha256:rev001aaa00000000000000000000000000000000000000000000000000000000",
    "anchor_context_before": "",
    "anchor_context_after": ", assume the floor is now",
    "replacement": "Signing in the next 18 months",
    "rationale": "Wording: drop the conditional 'If you're' framing; the imperative is stronger and matches voice.",
    "category": "wording",
    "source_skill": "factory_adv_cut",
    "source_run_id": "01HXYZRUNADVCUT001AAAAAAAAA"
  },
  {
    "schema_version": "0",
    "revision_id": "01HXYZREV001AAAAAAAAAAAAAA",
    "target_content_hash": "sha256:rev001aaa00000000000000000000000000000000000000000000000000000000",
    "source_map_refs": [
      {
        "block_id": "blk_0001",
        "span_id": null,
        "text_hash": "sha256:b0001hash00000000000000000000000000000000000000000000000000000000"
      }
    ],
    "markdown_range": { "start": 0, "end": 268 },
    "anchor_quote": "When Embracer wrote down $2.1B",
    "anchor_content_hash": "sha256:rev001aaa00000000000000000000000000000000000000000000000000000000",
    "anchor_context_before": "",
    "anchor_context_after": " last quarter",
    "replacement": null,
    "rationale": "Structure: lede frames the writedown first, then pivots to the real claim (reclassification). Reorder so reclassification leads.",
    "category": "structure",
    "source_skill": "factory_adv_cut",
    "source_run_id": "01HXYZRUNADVCUT001AAAAAAAAA"
  },
  {
    "schema_version": "0",
    "revision_id": "01HXYZREV001AAAAAAAAAAAAAA",
    "target_content_hash": "sha256:rev001aaa00000000000000000000000000000000000000000000000000000000",
    "source_map_refs": [
      {
        "block_id": "blk_0005",
        "span_id": null,
        "text_hash": "sha256:b0005hash00000000000000000000000000000000000000000000000000000000"
      }
    ],
    "markdown_range": { "start": 942, "end": 1000 },
    "anchor_quote": "Negotiate against that, not against the 2022 numbers.",
    "anchor_content_hash": "sha256:rev001aaa00000000000000000000000000000000000000000000000000000000",
    "anchor_context_before": "now the ceiling. ",
    "anchor_context_after": "",
    "replacement": "Numbers — not adjectives — close the deal.",
    "rationale": "Voice drift: trailing imperative is functional but loses the GameMakers cadence. Match signature ('numbers > adjectives').",
    "category": "voice_drift",
    "source_skill": "factory_adv_cut",
    "source_run_id": "01HXYZRUNADVCUT001AAAAAAAAA"
  }
]
